Sheet: BOM
A1: # | B1: Item Name | C1: [de] Produkt-Name | D1: Item Model | E1: EAN/GTIN | F1: Item Description | G1: [de] Produkt-Beschreibung | H1: Pack-aging | I1: repair-m01 | J1: repair-m02 | K1: repair-m03 | L1: repair-m04 | M1: Layer depth | N1: outer width [mm] | O1: outer length [mm] | P1: height [mm] | Q1: Supplier | R1: eur | S1: Stock Batch1 | T1: link1 | U1: link2 | V1: Pick-Note
A2: i0001 | B2: Headlight | D2: Xcell H280 | E2: 4042883492769 | I2: 1 | M2: 4 | N2: 60 | O2: 65 | P2: 38 | Q2: reichelt | R2: of:=8.4*1.19 -> 9.996 | S2: 5 | T2: https://www.reichelt.de/de/de/shop/produkt/stirnleuchte_h280-365572 | V2: add rubber band (from a bicycle tube)
A3: i0002 | B3: First Aid Kit | D3: Wundmed Traveller-Set 32-teilig | I3: 1 | M3: 4 | P3: 40 | Q3: docmorris | R3: 5.49 | S3: 5 | T3: https://www.docmorris.de/travellerset-32teilig-wundmed/16237371 | V3: remove triangle cloth
A4: i0003 | B4: Ointment Gel | D4: Medice Brand- und Wundgel | I4: 1 | Q4: docmorris | R4: 7.49 | S4: 5 | T4: https://www.docmorris.de/medice-brand-und-wundgel/03839625#queryID=2e3967ea7e01dcd56b7d54530a37fa61&position=1&objectID=LG8EDRVU_6fee4fe5-caf4-485d-9e1a-a3a5808ec912 | V4: put into first aid kit
A5: i0004 | B5: Scissors | C5: Schere | D5: Martor SECUMAX 363 | E5: 4002632921315 | I5: 1 | M5: 1 | Q5: reichelt | R5: of:=13.44*1.19 -> 15.9936 | S5: 5 | T5: https://www.reichelt.de/de/de/shop/produkt/schere_secumax_363_sicherheitsschere_56_mm-289695
A6: i0005 | B6: Super Glue | C6: Sekundenkleber | D6: UHU Sekundenkleber Blitzschnell Minis | F6: liquid, box | G6: flüssig, dose | I6: 1 | M6: 2 | Q6: bauhaus | R6: 3.75 | S6: 5 | T6: https://www.bauhaus.info/sekundenkleber/uhu-sekundenkleber-blitzschnell-minis/p/15350559 | V6: the extra-glue-tube is leftover
A7: i0006 | B7: USB Power Adaptor | D7: Pine Power | F7: min. 65W | I7: 1 | M7: 4 | Q7: eleshop | R7: of:=20.66*1.19 -> 24.5854 | S7: 5 | T7: https://eleshop.eu/compact-2-port-65w-pd-gan-fast-charging-usb-c-adapter.html
A8: i0007 | B8: Pen | C8: Kugelschreiber | D8: Schneider K 15 | I8: 1 | M8: 1 | Q8: reichelt | R8: of:=14.95/50 -> 0.299 | T8: https://www.reichelt.de/de/de/shop/produkt/kugelschreiber_-_mine_blau_-_50er-karton_farbig_sortiert-311967
A9: i0008 | B9: Permanent Marker | C9: Permanent Marker | D9: CD Marker, wasserfest | F9: fine tip (CD-Marker) | I9: 1 | M9: 1 | Q9: reichelt | R9: of:=1.64*1.19 -> 1.9516 | S9: 5 | T9: https://www.reichelt.de/de/de/shop/produkt/cd-marker_schwarz-53414
A10: i0009 | B10: Measure Tape | C10: Maßband | D10: Stanley Kapselmaßband PowerLock | I10: 1 | M10: 3 | Q10: bauhaus | R10: 9.95 | S10: 5 | T10: https://www.bauhaus.info/massbaender/stanley-kapselmassband-powerlock/p/28496160
A11: i0010 | B11: Metal Ruler | C11: Metall-Lineal | D11: Scala Maßstab INOX | F11: 15cm length | I11: 1 | M11: 1 | Q11: bauhaus | R11: 4.9 | S11: 5 | T11: https://www.bauhaus.info/lineale/scala-massstab-inox/p/30830684 | U11: https://www.reichelt.de/de/de/shop/produkt/stahllineal-set_15_20_30_cm-341310
A12: i0011 | B12: Lighter | F12: torch lighter in normal form factor | I12: 1 | M12: 2 | Q12: local spaeti / amazon | R12: 2.5 | S12: 5 | T12: https://www.amazon.de/dp/B0CMD95VNG?ref=ppx_yo2ov_dt_b_fed_asin_title
A13: i0012 | B13: USB Stick | D13: Delock | E13: 4043619540747 | F13: 32GB | I13: 1 | M13: 1 | Q13: reichelt | R13: 11.95 | S13: 5 | T13: https://www.reichelt.de/de/de/shop/produkt/usb-stick_usb_3_2_32_gb_usb-c_usb-a-275413
A14: i0013 | B14: USB Voltmeter | C14: USB Voltmeter | E14: 9900002236227 | J14: 1 | M14: 2 | Q14: reichelt | R14: of:=2.98*1.19 -> 3.5462 | S14: 5 | T14: https://www.reichelt.de/de/de/shop/produkt/raspberry_pi_-_ampere-_voltmeter_1-fach_usb-223622
A15: i0014 | B15: Soldering Tip Cleaner | C15: Lötspitzenreiniger | J15: 1 | M15: 3 | Q15: ifixit | R15: 9.95 | S15: 5 | T15: https://www.ifixit.com/de-de/products/ifixit-soldering-tip-cleaner | V15: cut off the cover/lid
A16: i0015 | B16: Solder Wick | C16: Entlötlitze | J16: 1 | M16: 2 | Q16: ifixit | R16: 4.95 | S16: 5 | T16: https://www.ifixit.com/de-de/products/ifixit-desoldering-wick
A17: i0016 | B17: Soldering Iron | C17: Lötkolben | D17: ZD-708 | E17: 4250019108730 | F17: 50W | J17: 1 | M17: 4 | Q17: reichelt | R17: of:=8.39*1.19 -> 9.9841 | S17: 5 | T17: https://www.reichelt.de/de/de/shop/produkt/loetkolben_30_w_temperaturgeregelt-90924 | V17: pick the manual as well, remove metal stand, add rubber band (from a bicycle tube)
A18: i0017 | B18: Soldering Flux | C18: Löt-Flussmittel | D18: iFixit no-clean flux | J18: 1 | M18: 1 | Q18: ifixit | R18: 4.95 | S18: 5 | T18: https://www.ifixit.com/de-de/products/no-clean-flux
A19: i0018 | B19: Soldering Mini-Stand | C19: Lötkolben-Halter | D19: PINECIL Portable Mini Stand | J19: 1 | M19: 2 | Q19: eleshop | R19: of:=4.09*1.19 -> 4.8671 | S19: 5 | T19: https://eleshop.eu/pinecil-portable-mini-stand.html | V19: put rubber around it
A20: i0019 | B20: Solder Wire | J20: 1 | M20: 2 | Q20: ifixit | R20: 4.95 | S20: 5 | T20: https://www.ifixit.com/de-de/products/lead-free-solder
A21: i0020 | B21: Multimeter | D21: TrueRMS MS0135 | E21: 4260508890534 | J21: 1 | M21: 4 | Q21: reichelt | R21: of:=28.15*1.19 -> 33.4985 | S21: 5 | T21: https://www.reichelt.de/de/de/shop/produkt/truerms_digital-multimeter_6_000_counts_600_v_ncv-297581 | V21: pick the entire black textile casing
A22: i0021 | B22: Essential Electronics Toolkit | K22: 1 | M22: 4 | Q22: ifixit | R22: 24.95 | S22: 5 | T22: https://www.ifixit.com/de-de/products/essential-electronics-toolkit-b-stock | U22: https://www.ifixit.com/de-de/products/moray-driver-kit | V22: pick the brochure and stickers as well
A23: i0022 | B23: Moray Driver Kit | K23: 1 | M23: 3 | Q23: ifixit | R23: 16.95 | S23: 5 | T23: https://www.ifixit.com/de-de/products/moray-driver-kit-b-stock | V23: pick the sticker as well
A24: i0023 | B24: Brush + Eraser | K24: 1 | M24: 1 | Q24: ifixit | R24: 2.95 | S24: 5 | T24: https://www.ifixit.com/de-de/products/detailing-eraser
A25: i0024 | B25: Telescope Magnet | E25: 4014991540199 | F25: just this one tool from the set | K25: 1 | M25: 1 | Q25: reichelt | R25: 6.2 | S25: 5 | T25: https://www.reichelt.de/de/de/shop/produkt/magnet-kombi-set_teleskopmagnet_teleskopspiegel_magnetschale-184628 | V25: take just the telescope magnet from the set, rest → leftover-box
A26: i0025 | B26: Mini Duct Tape | C26: Mini-Gewebeband | D26: Tesa Extra Power Gewebeband PERFECT | F26: L x B: 2,75 m x 19 mm | L26: 1 | M26: 2 | Q26: bauhaus | R26: 2.95 | S26: 5 | T26: https://www.bauhaus.info/panzertape/tesa-extra-power-gewebeband-perfect/p/15387182
A27: i0026 | B27: Mini Caliper | C27: Mini Messschieber | L27: 1 | M27: 0.5 | Q27: bauhaus | R27: 11.8 | S27: 5 | T27: https://www.bauhaus.info/winkelmesser-schieblehren/scala-taschenschieblehre/p/30823222?search_p=true&adb_search=knopfma%C3%9F | V27: Glueing assembly: remove half of the cardboard layer
A28: i0027 | B28: Bit-Set | D28: Hazet 2260X/10N | L28: 1 | M28: 3 | Q28: bauhaus | R28: 26.8 | S28: 5 | T28: https://www.bauhaus.info/bit-sets/hazet-bit-set-2260x10n/p/26750860 | V28: put bit-holder into the plastic box (middle)
A29: i0028 | B29: Bit-Set | D29: Wera Bit-Set Mini-Check | L29: 2 | M29: 3 | Q29: bauhaus | R29: 16.95 | S29: 10 | T29: https://www.bauhaus.info/bit-sets/wera-bit-set-mini-check/p/20735887 | V29: empty one of them completely and put the bits in the leftover box
A30: i0029 | B30: Bit-Set | D30: Wolfcraft Bit-Set Solid safety, Torx mit Stift | F30: TX 10/15/20, 50 mm | L30: 1 | Q30: bauhaus | R30: 6.6 | S30: 5 | T30: https://www.bauhaus.info/bits/wolfcraft-bit-set-solid-safety-torx-mit-stift/p/25306464 | V30: put them into the Wera Bit-Set Mini-Check
A31: i0030 | B31: Bit-Set | D31: Wolfcraft Bit-Set Solid safety, Torx mit Stift | F31: TX 25/27/30, 50 mm | L31: 1 | Q31: bauhaus | R31: 6.49 | S31: 5 | T31: https://www.bauhaus.info/bits/wolfcraft-bit-set-solid-safety-torx-mit-stift/p/25307564 | V31: put them into the Wera Bit-Set Mini-Check
A32: i0031 | B32: Magnet | F32: product seems to be discontinued. 6mm × 6mm × 18mm (can be shorter) | L32: 1 | Q32: bauhaus | S32: 5 | T32: https://www.hood.de/i/a-s-creation-pop-up-magnet-5-magnet-rechteckig-6-x-18-x-6-mm-468154-sil-86948218.htm | V32: put into the Wera Bit-Set Mini-Check
A33: i0032 | B33: Adjustable Wrench | F33: 150mm | L33: 1 | M33: 1 | Q33: bauhaus | R33: 7.75 | S33: 5 | T33: https://www.bauhaus.info/rollgabelschluessel/matador-rollgabelschluessel/p/11114287
A34: i0033 | B34: Pointed Pliers | C34: Spitzzange | E34: 4003773013082 | L34: 1 | M34: 1 | Q34: reichelt | R34: of:=15.46*1.19 -> 18.3974 | S34: 5 | T34: https://www.reichelt.de/de/de/shop/produkt/flachrundzange_radiozange_140_mm-115789
A35: i0034 | B35: Screwdriver Power Tester | C35: Spannungsprüfer | E35: 4010995052713 | L35: 1 | M35: 2 | Q35: reichelt | R35: of:=3.28*1.19 -> 3.9032 | S35: 5 | T35: https://www.reichelt.de/de/de/shop/produkt/spannungspruefer_220-250_volt-320927
A36: i0035 | B36: Cutter | L36: 1 | M36: 2 | Q36: ifixit | R36: 4.95 | S36: 5 | T36: https://www.ifixit.com/de-de/products/precision-utility-knife
A37: i0036 | B37: Case | C37: Koffer | D37: MAX300 black | H37: 1 | Q37: xenotec | R37: 51.95 | S37: 5 (1 mit Mängeln) | T37: https://xenotec-shop.de/produkt/max300/
A38: i0037 | B38: Hook-and-Loop (Hook) | C38: Klett Haken | G38: Haken | H38: 2 | Q38: klettladen | R38: 5.34 | S38: genug | T38: https://www.klettladen.de/product_info.php/products_id/497 | V38: cut 10cm off (a bit less than 10cm)
A39: i0038 | B39: Hook-and-Loop (Loop) | C39: Klett Flausch | G39: Flausch | H39: 2 | Q39: klettladen | R39: 5.34 | S39: genug | T39: https://www.klettladen.de/product_info.php/products_id/498 | V39: cut 10cm off (a bit less than 10cm)
A40: i0039 | B40: Sandpaper | C40: Schmirgelpapier | F40: 120 sandpaper grit | G40: 120er Körnung | H40: 1 | Q40: bauhaus | R40: of:=0.85/2 -> 0.425 | S40: 5 | T40: https://www.bauhaus.info/schleifpapier/bauhaus-schleifpapier/p/11376142 | V40: put just half of it inside
A41: i0040 | B41: Cable-Tie | C41: Kabelbinder | F41: 200mm x 3,6mm | H41: 1 | Q41: bauhaus | R41: 7.99 | T41: https://www.bauhaus.info/kabelbinder/schneider-electric-kabelbinder/p/27566875 | V41: take ca. 10 and put a rubber around it
A42: i0041 | B42: Heat Shrink Tubes | C42: Schrumpfschläuche | D42: Delock Schrumpfschlauch Sortimentsbox, schwarz 196-teilig | E42: 4043619207350 | F42: several 33mm long pieces | H42: 1 | Q42: reichelt | R42: of:=10.95/(11*3) -> 0.331818181818182 | S42: 5 | T42: https://www.reichelt.de/de/de/shop/produkt/schrumpfschlauch_sortimentsbox_schwarz_196-teilig-316532 | V42: Put the pack of tubes into the upper part of the soldering mini-stand
A43: i0042 | B43: iFixit Manifest Card | H43: 1 | Q43: ifixit | R43: 0.1 | S43: 5 | T43: https://www.ifixit.com/de-de/products/self-repair-manifesto?variant=32403764248661
A44: i0043 | B44: Transparent Pocket | C44: Sichttasche | D44: Durable Sichttasche A5 | E44: 4005546215754 | F44: A5 | H44: 1 | Q44: reichelt | R44: of:=8.95/5 -> 1.79 | T44: https://www.reichelt.de/de/de/shop/produkt/sichttasche_a5_mit_aufhaengung_10_stueck-337326 | V44: put manuals, paper etc inside
A45: i0044 | B45: Label | C45: Etikett | D45: with labelprinter like e.g. Dymo. Module number and module name | F45: max 12mm × 51mm | H45: 4 | T45: https://www.dymoshop.eu/de/prod94-Dymo-D1-Standardetiketten-12mm-x-7m-blackwhite-S0720530.html
R47: of:=SUM([.R2:.R46]) -> 406.458918181818

Sheet: special items (wip)
A1: Step | B1: [de] Arbeitsschritte | C1: Item Model | D1: Item Description | E1: [de] Produkt-Beschreibung | F1: Packaging / general | G1: M001 | H1: M002 | I1: M003 | J1: M004 | K1: Note
A2: rubber band | B2: Gummiband | D2: take an old bicycle rubber tube and cut ca 5mm „ring“ off | E2: einen alten Fahrradschlauch nehmen und ca 5mm „Ring“ abschneiden | F2: 1 | G2: 1 | H2: 2
A3: Hook-and-loop cutting | B3: Klettband | F3: 2 + 2 | K3: Cut 2× hook and 2× loop to ca 10cm
A4: sandpaper | B4: Schmirgelpapier | F4: 1 | K4: Cut to 14cm × 23cm (so, cut 1 sheet in half)
A5: heat shrink tubes | B5: Schrumpfschläuche | F5: 1 | K5: End-result: 33mm long, 12mm wide. Cut the tubes into 33mm long pieces. Fill the biggest (12mm wide) tube with smaller 33mm long pieces.
A6: Sticker | K6: put on backside of the modules and two on the case
A7: Label | B7: Etiketten | F7: 1 | G7: 1 | H7: 1 | I7: 1 | J7: 1 | K7: Print for each Module one label: „module-number [new-line] module-name“ and one label for the name of the kit
A8: Laser-cutting
A9: printing of photos
A10: 3D-printing of the glueing tool

Sheet: Modules
A1: # | B1: Module Name | C1: [de] Modul-Name | D1: Module Description | E1: [de] Modul-Beschreibung | F1: Pack-aging | G1: Urban Repair Kit | I1: Amount of Layers | J1: eur | K1: Stock Batch1 | L1: link1 | M1: link2 | N1: Pick-Note
A2: repair-m01 | B2: Essentials | C2: Essentials | G2: 1 | I2: 4
A3: repair-m02 | B3: Soldering | C3: Löten | G3: 1 | I3: 4
A4: repair-m03 | B4: Mobile Devices | C4: Mobile Geräte | G4: 1 | I4: 4
A5: repair-m04 | B5: Basic Tools | C5: Basis-Werkzeuge | G5: 1 | I5: 3
A6: repair-m05 | B6: Mobile Soldering | C6: Mobiles Löten
A7: repair-m06 | B7: Bike Basics | C7: Fahrrad Allgemein
A8: repair-m07 | B8: Wrenches | C8: Schraubenschlüssel

Sheet: Pick-List (Repair Kit)
B1: Picklist Urban Repair Kit
B2: Qty | C2: Item Name | D2: Layer Depth | E2: Item Info | F2: Note
A3: □ | B3: of:=SUM([$BOM.H2:.L2]) -> 1 | C3: of:=[$BOM.B2] -> Headlight | D3: of:=IF([$BOM.M2]="";"";[$BOM.M2]) -> 4 | E3: of:=CONCATENATE([$BOM.D2];IF([$BOM.F2]="";"";CONCATENATE(" ("; [$BOM.F2]; ")"))) -> Xcell H280 | F3: of:=IF([$BOM.V2]="";"";[$BOM.V2]) -> add rubber band (from a bicycle tube)
A4: □ | B4: of:=SUM([$BOM.H3:.L3]) -> 1 | C4: of:=[$BOM.B3] -> First Aid Kit | D4: of:=IF([$BOM.M3]="";"";[$BOM.M3]) -> 4 | E4: of:=CONCATENATE([$BOM.D3];IF([$BOM.F3]="";"";CONCATENATE(" ("; [$BOM.F3]; ")"))) -> Wundmed Traveller-Set 32-teilig | F4: of:=IF([$BOM.V3]="";"";[$BOM.V3]) -> remove triangle cloth
A5: □ | B5: of:=SUM([$BOM.H4:.L4]) -> 1 | C5: of:=[$BOM.B4] -> Ointment Gel | D5: of:=IF([$BOM.M4]="";"";[$BOM.M4]) ->  | E5: of:=CONCATENATE([$BOM.D4];IF([$BOM.F4]="";"";CONCATENATE(" ("; [$BOM.F4]; ")"))) -> Medice Brand- und Wundgel | F5: of:=IF([$BOM.V4]="";"";[$BOM.V4]) -> put into first aid kit
A6: □ | B6: of:=SUM([$BOM.H5:.L5]) -> 1 | C6: of:=[$BOM.B5] -> Scissors | D6: of:=IF([$BOM.M5]="";"";[$BOM.M5]) -> 1 | E6: of:=CONCATENATE([$BOM.D5];IF([$BOM.F5]="";"";CONCATENATE(" ("; [$BOM.F5]; ")"))) -> Martor SECUMAX 363 | F6: of:=IF([$BOM.V5]="";"";[$BOM.V5]) -> 
A7: □ | B7: of:=SUM([$BOM.H6:.L6]) -> 1 | C7: of:=[$BOM.B6] -> Super Glue | D7: of:=IF([$BOM.M6]="";"";[$BOM.M6]) -> 2 | E7: of:=CONCATENATE([$BOM.D6];IF([$BOM.F6]="";"";CONCATENATE(" ("; [$BOM.F6]; ")"))) -> UHU Sekundenkleber Blitzschnell Minis  (liquid, box) | F7: of:=IF([$BOM.V6]="";"";[$BOM.V6]) -> the extra-glue-tube is leftover
A8: □ | B8: of:=SUM([$BOM.H7:.L7]) -> 1 | C8: of:=[$BOM.B7] -> USB Power Adaptor | D8: of:=IF([$BOM.M7]="";"";[$BOM.M7]) -> 4 | E8: of:=CONCATENATE([$BOM.D7];IF([$BOM.F7]="";"";CONCATENATE(" ("; [$BOM.F7]; ")"))) -> Pine Power (min. 65W) | F8: of:=IF([$BOM.V7]="";"";[$BOM.V7]) -> 
A9: □ | B9: of:=SUM([$BOM.H8:.L8]) -> 1 | C9: of:=[$BOM.B8] -> Pen | D9: of:=IF([$BOM.M8]="";"";[$BOM.M8]) -> 1 | E9: of:=CONCATENATE([$BOM.D8];IF([$BOM.F8]="";"";CONCATENATE(" ("; [$BOM.F8]; ")"))) -> Schneider K 15 | F9: of:=IF([$BOM.V8]="";"";[$BOM.V8]) -> 
A10: □ | B10: of:=SUM([$BOM.H9:.L9]) -> 1 | C10: of:=[$BOM.B9] -> Permanent Marker | D10: of:=IF([$BOM.M9]="";"";[$BOM.M9]) -> 1 | E10: of:=CONCATENATE([$BOM.D9];IF([$BOM.F9]="";"";CONCATENATE(" ("; [$BOM.F9]; ")"))) -> CD Marker, wasserfest (fine tip (CD-Marker)) | F10: of:=IF([$BOM.V9]="";"";[$BOM.V9]) -> 
A11: □ | B11: of:=SUM([$BOM.H10:.L10]) -> 1 | C11: of:=[$BOM.B10] -> Measure Tape | D11: of:=IF([$BOM.M10]="";"";[$BOM.M10]) -> 3 | E11: of:=CONCATENATE([$BOM.D10];IF([$BOM.F10]="";"";CONCATENATE(" ("; [$BOM.F10]; ")"))) -> Stanley Kapselmaßband PowerLock  | F11: of:=IF([$BOM.V10]="";"";[$BOM.V10]) -> 
A12: □ | B12: of:=SUM([$BOM.H11:.L11]) -> 1 | C12: of:=[$BOM.B11] -> Metal Ruler | D12: of:=IF([$BOM.M11]="";"";[$BOM.M11]) -> 1 | E12: of:=CONCATENATE([$BOM.D11];IF([$BOM.F11]="";"";CONCATENATE(" ("; [$BOM.F11]; ")"))) -> Scala Maßstab INOX  (15cm length) | F12: of:=IF([$BOM.V11]="";"";[$BOM.V11]) -> 
A13: □ | B13: of:=SUM([$BOM.H12:.L12]) -> 1 | C13: of:=[$BOM.B12] -> Lighter | D13: of:=IF([$BOM.M12]="";"";[$BOM.M12]) -> 2 | E13: of:=CONCATENATE([$BOM.D12];IF([$BOM.F12]="";"";CONCATENATE(" ("; [$BOM.F12]; ")"))) ->  (torch lighter in normal form factor) | F13: of:=IF([$BOM.V12]="";"";[$BOM.V12]) -> 
A14: □ | B14: of:=SUM([$BOM.H13:.L13]) -> 1 | C14: of:=[$BOM.B13] -> USB Stick | D14: of:=IF([$BOM.M13]="";"";[$BOM.M13]) -> 1 | E14: of:=CONCATENATE([$BOM.D13];IF([$BOM.F13]="";"";CONCATENATE(" ("; [$BOM.F13]; ")"))) -> Delock  (32GB) | F14: of:=IF([$BOM.V13]="";"";[$BOM.V13]) -> 
A15: □ | B15: of:=SUM([$BOM.H14:.L14]) -> 1 | C15: of:=[$BOM.B14] -> USB Voltmeter | D15: of:=IF([$BOM.M14]="";"";[$BOM.M14]) -> 2 | E15: of:=CONCATENATE([$BOM.D14];IF([$BOM.F14]="";"";CONCATENATE(" ("; [$BOM.F14]; ")"))) ->  | F15: of:=IF([$BOM.V14]="";"";[$BOM.V14]) -> 
A16: □ | B16: of:=SUM([$BOM.H15:.L15]) -> 1 | C16: of:=[$BOM.B15] -> Soldering Tip Cleaner | D16: of:=IF([$BOM.M15]="";"";[$BOM.M15]) -> 3 | E16: of:=CONCATENATE([$BOM.D15];IF([$BOM.F15]="";"";CONCATENATE(" ("; [$BOM.F15]; ")"))) ->  | F16: of:=IF([$BOM.V15]="";"";[$BOM.V15]) -> cut off the cover/lid
A17: □ | B17: of:=SUM([$BOM.H16:.L16]) -> 1 | C17: of:=[$BOM.B16] -> Solder Wick | D17: of:=IF([$BOM.M16]="";"";[$BOM.M16]) -> 2 | E17: of:=CONCATENATE([$BOM.D16];IF([$BOM.F16]="";"";CONCATENATE(" ("; [$BOM.F16]; ")"))) ->  | F17: of:=IF([$BOM.V16]="";"";[$BOM.V16]) -> 
A18: □ | B18: of:=SUM([$BOM.H17:.L17]) -> 1 | C18: of:=[$BOM.B17] -> Soldering Iron | D18: of:=IF([$BOM.M17]="";"";[$BOM.M17]) -> 4 | E18: of:=CONCATENATE([$BOM.D17];IF([$BOM.F17]="";"";CONCATENATE(" ("; [$BOM.F17]; ")"))) -> ZD-708 (50W) | F18: of:=IF([$BOM.V17]="";"";[$BOM.V17]) -> pick the manual as well, remove metal stand, add rubber band (from a bicycle tube)
A19: □ | B19: of:=SUM([$BOM.H18:.L18]) -> 1 | C19: of:=[$BOM.B18] -> Soldering Flux | D19: of:=IF([$BOM.M18]="";"";[$BOM.M18]) -> 1 | E19: of:=CONCATENATE([$BOM.D18];IF([$BOM.F18]="";"";CONCATENATE(" ("; [$BOM.F18]; ")"))) -> iFixit no-clean flux | F19: of:=IF([$BOM.V18]="";"";[$BOM.V18]) -> 
A20: □ | B20: of:=SUM([$BOM.H19:.L19]) -> 1 | C20: of:=[$BOM.B19] -> Soldering Mini-Stand | D20: of:=IF([$BOM.M19]="";"";[$BOM.M19]) -> 2 | E20: of:=CONCATENATE([$BOM.D19];IF([$BOM.F19]="";"";CONCATENATE(" ("; [$BOM.F19]; ")"))) -> PINECIL Portable Mini Stand | F20: of:=IF([$BOM.V19]="";"";[$BOM.V19]) -> put rubber around it
A21: □ | B21: of:=SUM([$BOM.H20:.L20]) -> 1 | C21: of:=[$BOM.B20] -> Solder Wire | D21: of:=IF([$BOM.M20]="";"";[$BOM.M20]) -> 2 | E21: of:=CONCATENATE([$BOM.D20];IF([$BOM.F20]="";"";CONCATENATE(" ("; [$BOM.F20]; ")"))) ->  | F21: of:=IF([$BOM.V20]="";"";[$BOM.V20]) -> 
A22: □ | B22: of:=SUM([$BOM.H21:.L21]) -> 1 | C22: of:=[$BOM.B21] -> Multimeter | D22: of:=IF([$BOM.M21]="";"";[$BOM.M21]) -> 4 | E22: of:=CONCATENATE([$BOM.D21];IF([$BOM.F21]="";"";CONCATENATE(" ("; [$BOM.F21]; ")"))) -> TrueRMS MS0135 | F22: of:=IF([$BOM.V21]="";"";[$BOM.V21]) -> pick the entire black textile casing
A23: □ | B23: of:=SUM([$BOM.H22:.L22]) -> 1 | C23: of:=[$BOM.B22] -> Essential Electronics Toolkit | D23: of:=IF([$BOM.M22]="";"";[$BOM.M22]) -> 4 | E23: of:=CONCATENATE([$BOM.D22];IF([$BOM.F22]="";"";CONCATENATE(" ("; [$BOM.F22]; ")"))) ->  | F23: of:=IF([$BOM.V22]="";"";[$BOM.V22]) -> pick the brochure and stickers as well
A24: □ | B24: of:=SUM([$BOM.H23:.L23]) -> 1 | C24: of:=[$BOM.B23] -> Moray Driver Kit | D24: of:=IF([$BOM.M23]="";"";[$BOM.M23]) -> 3 | E24: of:=CONCATENATE([$BOM.D23];IF([$BOM.F23]="";"";CONCATENATE(" ("; [$BOM.F23]; ")"))) ->  | F24: of:=IF([$BOM.V23]="";"";[$BOM.V23]) -> pick the sticker as well
A25: □ | B25: of:=SUM([$BOM.H24:.L24]) -> 1 | C25: of:=[$BOM.B24] -> Brush + Eraser | D25: of:=IF([$BOM.M24]="";"";[$BOM.M24]) -> 1 | E25: of:=CONCATENATE([$BOM.D24];IF([$BOM.F24]="";"";CONCATENATE(" ("; [$BOM.F24]; ")"))) ->  | F25: of:=IF([$BOM.V24]="";"";[$BOM.V24]) -> 
A26: □ | B26: of:=SUM([$BOM.H25:.L25]) -> 1 | C26: of:=[$BOM.B25] -> Telescope Magnet | D26: of:=IF([$BOM.M25]="";"";[$BOM.M25]) -> 1 | E26: of:=CONCATENATE([$BOM.D25];IF([$BOM.F25]="";"";CONCATENATE(" ("; [$BOM.F25]; ")"))) ->  (just this one tool from the set) | F26: of:=IF([$BOM.V25]="";"";[$BOM.V25]) -> take just the telescope magnet from the set, rest → leftover-box
A27: □ | B27: of:=SUM([$BOM.H26:.L26]) -> 1 | C27: of:=[$BOM.B26] -> Mini Duct Tape | D27: of:=IF([$BOM.M26]="";"";[$BOM.M26]) -> 2 | E27: of:=CONCATENATE([$BOM.D26];IF([$BOM.F26]="";"";CONCATENATE(" ("; [$BOM.F26]; ")"))) -> Tesa Extra Power Gewebeband PERFECT  (L x B: 2,75 m x 19 mm) | F27: of:=IF([$BOM.V26]="";"";[$BOM.V26]) -> 
A28: □ | B28: of:=SUM([$BOM.H27:.L27]) -> 1 | C28: of:=[$BOM.B27] -> Mini Caliper | D28: of:=IF([$BOM.M27]="";"";[$BOM.M27]) -> 0.5 | E28: of:=CONCATENATE([$BOM.D27];IF([$BOM.F27]="";"";CONCATENATE(" ("; [$BOM.F27]; ")"))) ->  | F28: of:=IF([$BOM.V27]="";"";[$BOM.V27]) -> Glueing assembly: remove half of the cardboard layer 
A29: □ | B29: of:=SUM([$BOM.H28:.L28]) -> 1 | C29: of:=[$BOM.B28] -> Bit-Set | D29: of:=IF([$BOM.M28]="";"";[$BOM.M28]) -> 3 | E29: of:=CONCATENATE([$BOM.D28];IF([$BOM.F28]="";"";CONCATENATE(" ("; [$BOM.F28]; ")"))) -> Hazet 2260X/10N  | F29: of:=IF([$BOM.V28]="";"";[$BOM.V28]) -> put bit-holder into the plastic box (middle)
A30: □ | B30: of:=SUM([$BOM.H29:.L29]) -> 2 | C30: of:=[$BOM.B29] -> Bit-Set | D30: of:=IF([$BOM.M29]="";"";[$BOM.M29]) -> 3 | E30: of:=CONCATENATE([$BOM.D29];IF([$BOM.F29]="";"";CONCATENATE(" ("; [$BOM.F29]; ")"))) -> Wera Bit-Set Mini-Check | F30: of:=IF([$BOM.V29]="";"";[$BOM.V29]) -> empty one of them completely and put the bits in the leftover box
A31: □ | B31: of:=SUM([$BOM.H30:.L30]) -> 1 | C31: of:=[$BOM.B30] -> Bit-Set | D31: of:=IF([$BOM.M30]="";"";[$BOM.M30]) ->  | E31: of:=CONCATENATE([$BOM.D30];IF([$BOM.F30]="";"";CONCATENATE(" ("; [$BOM.F30]; ")"))) -> Wolfcraft Bit-Set Solid safety, Torx mit Stift  (TX 10/15/20, 50 mm) | F31: of:=IF([$BOM.V30]="";"";[$BOM.V30]) -> put them into the Wera Bit-Set Mini-Check
A32: □ | B32: of:=SUM([$BOM.H31:.L31]) -> 1 | C32: of:=[$BOM.B31] -> Bit-Set | D32: of:=IF([$BOM.M31]="";"";[$BOM.M31]) ->  | E32: of:=CONCATENATE([$BOM.D31];IF([$BOM.F31]="";"";CONCATENATE(" ("; [$BOM.F31]; ")"))) -> Wolfcraft Bit-Set Solid safety, Torx mit Stift  (TX 25/27/30, 50 mm) | F32: of:=IF([$BOM.V31]="";"";[$BOM.V31]) -> put them into the Wera Bit-Set Mini-Check
A33: □ | B33: of:=SUM([$BOM.H32:.L32]) -> 1 | C33: of:=[$BOM.B32] -> Magnet | D33: of:=IF([$BOM.M32]="";"";[$BOM.M32]) ->  | E33: of:=CONCATENATE([$BOM.D32];IF([$BOM.F32]="";"";CONCATENATE(" ("; [$BOM.F32]; ")"))) ->  (product seems to be discontinued. 6mm × 6mm × 18mm (can be shorter)) | F33: of:=IF([$BOM.V32]="";"";[$BOM.V32]) -> put into the Wera Bit-Set Mini-Check
A34: □ | B34: of:=SUM([$BOM.H33:.L33]) -> 1 | C34: of:=[$BOM.B33] -> Adjustable Wrench | D34: of:=IF([$BOM.M33]="";"";[$BOM.M33]) -> 1 | E34: of:=CONCATENATE([$BOM.D33];IF([$BOM.F33]="";"";CONCATENATE(" ("; [$BOM.F33]; ")"))) ->  (150mm) | F34: of:=IF([$BOM.V33]="";"";[$BOM.V33]) -> 
A35: □ | B35: of:=SUM([$BOM.H34:.L34]) -> 1 | C35: of:=[$BOM.B34] -> Pointed Pliers | D35: of:=IF([$BOM.M34]="";"";[$BOM.M34]) -> 1 | E35: of:=CONCATENATE([$BOM.D34];IF([$BOM.F34]="";"";CONCATENATE(" ("; [$BOM.F34]; ")"))) ->  | F35: of:=IF([$BOM.V34]="";"";[$BOM.V34]) -> 
A36: □ | B36: of:=SUM([$BOM.H35:.L35]) -> 1 | C36: of:=[$BOM.B35] -> Screwdriver Power Tester | D36: of:=IF([$BOM.M35]="";"";[$BOM.M35]) -> 2 | E36: of:=CONCATENATE([$BOM.D35];IF([$BOM.F35]="";"";CONCATENATE(" ("; [$BOM.F35]; ")"))) ->  | F36: of:=IF([$BOM.V35]="";"";[$BOM.V35]) -> 
A37: □ | B37: of:=SUM([$BOM.H36:.L36]) -> 1 | C37: of:=[$BOM.B36] -> Cutter | D37: of:=IF([$BOM.M36]="";"";[$BOM.M36]) -> 2 | E37: of:=CONCATENATE([$BOM.D36];IF([$BOM.F36]="";"";CONCATENATE(" ("; [$BOM.F36]; ")"))) ->  | F37: of:=IF([$BOM.V36]="";"";[$BOM.V36]) -> 
A38: □ | B38: of:=SUM([$BOM.H37:.L37]) -> 1 | C38: of:=[$BOM.B37] -> Case | D38: of:=IF([$BOM.M37]="";"";[$BOM.M37]) ->  | E38: of:=CONCATENATE([$BOM.D37];IF([$BOM.F37]="";"";CONCATENATE(" ("; [$BOM.F37]; ")"))) -> MAX300 black | F38: of:=IF([$BOM.V37]="";"";[$BOM.V37]) -> 
A39: □ | B39: of:=SUM([$BOM.H38:.L38]) -> 2 | C39: of:=[$BOM.B38] -> Hook-and-Loop (Hook) | D39: of:=IF([$BOM.M38]="";"";[$BOM.M38]) ->  | E39: of:=CONCATENATE([$BOM.D38];IF([$BOM.F38]="";"";CONCATENATE(" ("; [$BOM.F38]; ")"))) ->  | F39: of:=IF([$BOM.V38]="";"";[$BOM.V38]) -> cut 10cm off (a bit less than 10cm)
A40: □ | B40: of:=SUM([$BOM.H39:.L39]) -> 2 | C40: of:=[$BOM.B39] -> Hook-and-Loop (Loop) | D40: of:=IF([$BOM.M39]="";"";[$BOM.M39]) ->  | E40: of:=CONCATENATE([$BOM.D39];IF([$BOM.F39]="";"";CONCATENATE(" ("; [$BOM.F39]; ")"))) ->  | F40: of:=IF([$BOM.V39]="";"";[$BOM.V39]) -> cut 10cm off (a bit less than 10cm)
A41: □ | B41: of:=SUM([$BOM.H40:.L40]) -> 1 | C41: of:=[$BOM.B40] -> Sandpaper | D41: of:=IF([$BOM.M40]="";"";[$BOM.M40]) ->  | E41: of:=CONCATENATE([$BOM.D40];IF([$BOM.F40]="";"";CONCATENATE(" ("; [$BOM.F40]; ")"))) ->  (120 sandpaper grit) | F41: of:=IF([$BOM.V40]="";"";[$BOM.V40]) -> put just half of it inside
A42: □ | B42: of:=SUM([$BOM.H41:.L41]) -> 1 | C42: of:=[$BOM.B41] -> Cable-Tie | D42: of:=IF([$BOM.M41]="";"";[$BOM.M41]) ->  | E42: of:=CONCATENATE([$BOM.D41];IF([$BOM.F41]="";"";CONCATENATE(" ("; [$BOM.F41]; ")"))) ->  (200mm x 3,6mm) | F42: of:=IF([$BOM.V41]="";"";[$BOM.V41]) -> take ca. 10 and put a rubber around it
A43: □ | B43: of:=SUM([$BOM.H42:.L42]) -> 1 | C43: of:=[$BOM.B42] -> Heat Shrink Tubes | D43: of:=IF([$BOM.M42]="";"";[$BOM.M42]) ->  | E43: of:=CONCATENATE([$BOM.D42];IF([$BOM.F42]="";"";CONCATENATE(" ("; [$BOM.F42]; ")"))) -> Delock Schrumpfschlauch Sortimentsbox, schwarz 196-teilig (several 33mm long pieces) | F43: of:=IF([$BOM.V42]="";"";[$BOM.V42]) -> Put the pack of tubes into the upper part of the soldering mini-stand
A44: □ | B44: of:=SUM([$BOM.H43:.L43]) -> 1 | C44: of:=[$BOM.B43] -> iFixit Manifest Card | D44: of:=IF([$BOM.M43]="";"";[$BOM.M43]) ->  | E44: of:=CONCATENATE([$BOM.D43];IF([$BOM.F43]="";"";CONCATENATE(" ("; [$BOM.F43]; ")"))) ->  | F44: of:=IF([$BOM.V43]="";"";[$BOM.V43]) -> 
A45: □ | B45: of:=SUM([$BOM.H44:.L44]) -> 1 | C45: of:=[$BOM.B44] -> Transparent Pocket | D45: of:=IF([$BOM.M44]="";"";[$BOM.M44]) ->  | E45: of:=CONCATENATE([$BOM.D44];IF([$BOM.F44]="";"";CONCATENATE(" ("; [$BOM.F44]; ")"))) -> Durable Sichttasche A5 (A5) | F45: of:=IF([$BOM.V44]="";"";[$BOM.V44]) -> put manuals, paper etc inside